index,id,user_screen_name,name,text,created_at,userid,timestamp_ms,followers_count,userid_str,text_1
1,718432471583293440,ghiiagma,,"sing me a song until i was sleep, hug me in my sweet dreams, and leave me before i wake up.",Fri Apr 08 13:37:03 +0000 2016,1652316865,1460122623712,654,1652316865,"sing me a song until i was sleep, hug me in my sweet dreams, and leave me before i wake up."
2,718433525633007616,MiraaMelB,,"Done watching Before I wake (@ Cathay Cineplex in Petaling Jaya, Selangor) https://t.co/a94HeoqSsP",Fri Apr 08 13:41:15 +0000 2016,103239338,1460122875017,1241,103239338,"Done watching Before I wake (@ Cathay Cineplex in Petaling Jaya, Selangor) https://t.co/a94HeoqSsP"
3,718433587352088576,j4duk,,"Whatever deity who guide my life, dear lord don't let me die tonight. But if I shall before I wake, I'd accept my fate""",Fri Apr 08 13:41:29 +0000 2016,182228245,1460122889732,1635,182228245,"Whatever deity who guide my life, dear lord don't let me die tonight. But if I shall before I wake, I'd accept my fate"""
4,718433782240526336,MadameWeiss,,"RT @maybeswabey: ""Before I Wake Up"" written and illustrated with pure heart by @BTeckentrup ! NEW BLOG POST https://t.co/NagkJVB5FW https:/",Fri Apr 08 13:42:16 +0000 2016,836305056,1460122936197,1197,836305056,"RT @maybeswabey: ""Before I Wake Up"" written and illustrated with pure heart by @BTeckentrup ! NEW BLOG POST https://t.co/NagkJVB5FW https:/"
5,718434219584716800,NadhiraNazeri,,@zattyreiko_ Before I Wake! It was AMAAAAAZIIINNG. I liked it ,Fri Apr 08 13:44:00 +0000 2016,1159805568,1460123040468,290,1159805568,@zattyreiko_ Before I Wake! It was AMAAAAAZIIINNG. I liked it 
6,718435951182110720,jacobnestor568,,RT @josealvarado10_: I FaZe the fuck up before I wake the fuck up.,Fri Apr 08 13:50:53 +0000 2016,2888168106,1460123453313,154,2888168106,RT @josealvarado10_: I FaZe the fuck up before I wake the fuck up.
7,718437376394137600,YoungTizzy_,,"If i should die before i wake 
I pray the lord my soul to take",Fri Apr 08 13:56:33 +0000 2016,113514733,1460123793110,1236,113514733,"If i should die before i wake 
I pray the lord my soul to take"
8,718438098330349568,BrooklynnAshley,,@Ashlenie_Rivero its like I'm drained of all my energy before I wake up in the mornings ,Fri Apr 08 13:59:25 +0000 2016,37033714,1460123965233,1858,37033714,@Ashlenie_Rivero its like I'm drained of all my energy before I wake up in the mornings 
9,718438791493464064,fnazmi127,,@arifsugar34sen BEFORE I WAKE   !!,Fri Apr 08 14:02:10 +0000 2016,4357021094,1460124130496,29,4357021094,@arifsugar34sen BEFORE I WAKE   !!
10,718438980044230658,Nabihah17,,Before I wake ,Fri Apr 08 14:02:55 +0000 2016,185751855,1460124175450,292,185751855,Before I wake 
11,718440089240535040,syikss,,The storyline of Before I Wake is really unique ,Fri Apr 08 14:07:19 +0000 2016,1662535254,1460124439903,56,1662535254,The storyline of Before I Wake is really unique 
12,718440464093982721,lemondelemon,,"RT @maybeswabey: ""Before I Wake Up"" written and illustrated with pure heart by @BTeckentrup ! NEW BLOG POST https://t.co/NagkJVB5FW https:/",Fri Apr 08 14:08:49 +0000 2016,384436940,1460124529275,156,384436940,"RT @maybeswabey: ""Before I Wake Up"" written and illustrated with pure heart by @BTeckentrup ! NEW BLOG POST https://t.co/NagkJVB5FW https:/"
13,718440558914629632,Amarysia_gr,,Somnia  Before I wake (* *) https://t.co/SzWG9ydpV9 https://t.co/e0fsPGlT5T,Fri Apr 08 14:09:11 +0000 2016,2384952138,1460124551882,227,2384952138,Somnia  Before I wake (* *) https://t.co/SzWG9ydpV9 https://t.co/e0fsPGlT5T
14,718442215064932356,Jess1cah1cks,,"RT @Josh__Renshaw: if I die before I wake, at least in heaven I can skate",Fri Apr 08 14:15:46 +0000 2016,3221177241,1460124946739,234,3221177241,"RT @Josh__Renshaw: if I die before I wake, at least in heaven I can skate"
15,718442250208964608,nurulfatinazyra,,"Before I wake  #nightmovie (at @TGVCinemas in Petaling Jaya, Selangor) https://t.co/1IFpfP5em6",Fri Apr 08 14:15:55 +0000 2016,2849937612,1460124955118,91,2849937612,"Before I wake  #nightmovie (at @TGVCinemas in Petaling Jaya, Selangor) https://t.co/1IFpfP5em6"
16,718443097307230208,karansinghbasra,,Thought I would share Before I Wake (Rating-3/5) #WriteShareWin https://t.co/JVTKLNoev7 via @MouthShut,Fri Apr 08 14:19:17 +0000 2016,717910547237179396,1460125157082,15,717910547237179396,Thought I would share Before I Wake (Rating-3/5) #WriteShareWin https://t.co/JVTKLNoev7 via @MouthShut
17,718443225715855360,ssyaa,,Before i wake macam best,Fri Apr 08 14:19:47 +0000 2016,265945299,1460125187697,262,265945299,Before i wake macam best
18,718445992912138241,yasminnsyahirah,,"Anyway rating for the jungle book is 8/10
While I'd rate before i wake 9/10 .",Fri Apr 08 14:30:47 +0000 2016,716990989387190272,1460125847448,3,716990989387190272,"Anyway rating for the jungle book is 8/10
While I'd rate before i wake 9/10 ."
19,718446112542224384,gilinskathan,,RT @DerekLuh: Now I lay me down to sleep I pray the lord my soul to keep..If I should die before I wake I pray the Lord my soul to take..,Fri Apr 08 14:31:15 +0000 2016,836524632,1460125875970,25141,836524632,RT @DerekLuh: Now I lay me down to sleep I pray the lord my soul to keep..If I should die before I wake I pray the Lord my soul to take..
20,718446327328153600,faranabella_,,"before I wake, anyone? ",Fri Apr 08 14:32:07 +0000 2016,300739580,1460125927179,2189,300739580,"before I wake, anyone? "
21,718446338178945025,trouble_bubbaa,,"""If i die before i wake take the pain out my eyes nd the scars off my face""",Fri Apr 08 14:32:09 +0000 2016,3147279860,1460125929766,762,3147279860,"""If i die before i wake take the pain out my eyes nd the scars off my face"""
22,718447153295667200,yasminnsyahirah,,"Before i wake is such a great movie, many suspense, great well-planed plot. Horror movie at it's best.Second best horror film i ever watched",Fri Apr 08 14:35:24 +0000 2016,716990989387190272,1460126124105,3,716990989387190272,"Before i wake is such a great movie, many suspense, great well-planed plot. Horror movie at it's best.Second best horror film i ever watched"
23,718447799038296067,remrach,,"RT @ChuckNellis: Now I lay me down to sleep
I pray The Lord my soul to keep.
If I should die before I wake
I pray The Lord my soul to take",Fri Apr 08 14:37:58 +0000 2016,37839853,1460126278062,249,37839853,"RT @ChuckNellis: Now I lay me down to sleep
I pray The Lord my soul to keep.
If I should die before I wake
I pray The Lord my soul to take"
24,718449393838485504,GhostTalks_,,Update: I've now chosen my title!!! #BeforeIWake,Fri Apr 08 14:44:18 +0000 2016,68516173,1460126658292,185,68516173,Update: I've now chosen my title!!! #BeforeIWake
25,718450299975897088,SarcasticPest,,Wonder if you plan half of this shit before I wake up ,Fri Apr 08 14:47:54 +0000 2016,4290407776,1460126874332,183,4290407776,Wonder if you plan half of this shit before I wake up 
26,718450522202644480,thefyraaa,,Malam ni movienight before i wake,Fri Apr 08 14:48:47 +0000 2016,244086263,1460126927315,718,244086263,Malam ni movienight before i wake
27,718451857467817984,matthewxbaee,,RT @DerekLuh: Now I lay me down to sleep I pray the lord my soul to keep..If I should die before I wake I pray the Lord my soul to take..,Fri Apr 08 14:54:05 +0000 2016,3199273029,1460127245667,1082,3199273029,RT @DerekLuh: Now I lay me down to sleep I pray the lord my soul to keep..If I should die before I wake I pray the Lord my soul to take..
28,718452997408186373,celebrity_redd,,I hate it wen I get woke up before I wake up,Fri Apr 08 14:58:37 +0000 2016,2310817008,1460127517450,470,2310817008,I hate it wen I get woke up before I wake up
29,718453173178998784,yau_kian23,,Latest post..  watching Before I Wake at Tgv Cinema Permaisuri Imperial City Mall https://t.co/AClQOYHBoP,Fri Apr 08 14:59:19 +0000 2016,1899963104,1460127559357,584,1899963104,Latest post..  watching Before I Wake at Tgv Cinema Permaisuri Imperial City Mall https://t.co/AClQOYHBoP
30,718453175867543552,nfrzna_,,"Before I Wake  (at @TGVCinemas in Rawang, Selangor) https://t.co/h3np0V9OjJ",Fri Apr 08 14:59:19 +0000 2016,408209732,1460127559998,1434,408209732,"Before I Wake  (at @TGVCinemas in Rawang, Selangor) https://t.co/h3np0V9OjJ"
31,718454933440303104,BigDryDesert,,"if i might die before i wake, bury me inside the louis store",Fri Apr 08 15:06:19 +0000 2016,2973613990,1460127979036,85,2973613990,"if i might die before i wake, bury me inside the louis store"
32,718456125532704768,amandahudson__,,RT @OSUsophomore: can i please just skip the part of my day before i wake up tomorrow with 430-plus likes on my bullwinkles group insta? ,Fri Apr 08 15:11:03 +0000 2016,3318273733,1460128263253,125,3318273733,RT @OSUsophomore: can i please just skip the part of my day before i wake up tomorrow with 430-plus likes on my bullwinkles group insta? 
33,718456300250755073,nateslilbbg,,RT @DerekLuh: Now I lay me down to sleep I pray the lord my soul to keep..If I should die before I wake I pray the Lord my soul to take..,Fri Apr 08 15:11:44 +0000 2016,4842064776,1460128304909,200,4842064776,RT @DerekLuh: Now I lay me down to sleep I pray the lord my soul to keep..If I should die before I wake I pray the Lord my soul to take..
34,718457305457528832,MontanaZegsss,,weh i wanna watch Before I Wake ah tmrw,Fri Apr 08 15:15:44 +0000 2016,1118299381,1460128544569,327,1118299381,weh i wanna watch Before I Wake ah tmrw
35,718457664494133248,Lyriczonehunnid,,RT @DerekLuh: Now I lay me down to sleep I pray the lord my soul to keep..If I should die before I wake I pray the Lord my soul to take..,Fri Apr 08 15:17:10 +0000 2016,83761639,1460128630170,14539,83761639,RT @DerekLuh: Now I lay me down to sleep I pray the lord my soul to keep..If I should die before I wake I pray the Lord my soul to take..
36,718458114769440768,anissyafira_,,Before I wake or Jungle book? Cepat pilih,Fri Apr 08 15:18:57 +0000 2016,126554053,1460128737524,55366,126554053,Before I wake or Jungle book? Cepat pilih
37,718458322119053313,atynellyna_,,@anissyafira_ before I wake tak best sgt :(,Fri Apr 08 15:19:46 +0000 2016,44123271,1460128786960,2150,44123271,@anissyafira_ before I wake tak best sgt :(
38,718458736180736000,surayazulkhairi,,Before I wake ... &amp; review lepastuh please  https://t.co/TFS3xC5DwJ,Fri Apr 08 15:21:25 +0000 2016,260758085,1460128885680,600,260758085,Before I wake ... &amp; review lepastuh please  https://t.co/TFS3xC5DwJ
39,718458916078616577,syazwananuar,,nak tengok before i wake,Fri Apr 08 15:22:08 +0000 2016,134788915,1460128928571,915,134788915,nak tengok before i wake
40,718459014325997569,nikhdyh,,Before I wake https://t.co/b2jQBjfkv9,Fri Apr 08 15:22:31 +0000 2016,280294063,1460128951995,499,280294063,Before I wake https://t.co/b2jQBjfkv9
41,718459397870120960,Tim_Verby,,"RT @Tyler_Horning: If I die before I wake, I pray the lord my soul to take ",Fri Apr 08 15:24:03 +0000 2016,545950987,1460129043439,398,545950987,"RT @Tyler_Horning: If I die before I wake, I pray the lord my soul to take "
42,718459781112066048,IdiotFrank_,,"IF I DIE BEFORE I WAKE, AT LEAST IN HEAVEN I CAN SKATE",Fri Apr 08 15:25:34 +0000 2016,2978937857,1460129134811,772,2978937857,"IF I DIE BEFORE I WAKE, AT LEAST IN HEAVEN I CAN SKATE"
43,718460137472663552,buddymcdermott,,Get a call every morning before I wake up from This credit collection company... Called back today pretending to be a credit collector lol,Fri Apr 08 15:26:59 +0000 2016,540634284,1460129219774,466,540634284,Get a call every morning before I wake up from This credit collection company... Called back today pretending to be a credit collector lol
44,718460474665271298,MadeInDetroit44,,@VareseSarabande When will the soundtrack for Before I Wake (2016) be released? I thought it was supposed to be released today.,Fri Apr 08 15:28:20 +0000 2016,156466608,1460129300167,167,156466608,@VareseSarabande When will the soundtrack for Before I Wake (2016) be released? I thought it was supposed to be released today.
45,718460760033214464,kie_williamss,,"If I die before I wake, at least in heaven I can skate",Fri Apr 08 15:29:28 +0000 2016,979058263,1460129368204,1284,979058263,"If I die before I wake, at least in heaven I can skate"
46,718460799648292868,Sara_khela,,RT @DerekLuh: Now I lay me down to sleep I pray the lord my soul to keep..If I should die before I wake I pray the Lord my soul to take..,Fri Apr 08 15:29:37 +0000 2016,2526957454,1460129377649,326,2526957454,RT @DerekLuh: Now I lay me down to sleep I pray the lord my soul to keep..If I should die before I wake I pray the Lord my soul to take..
47,718461648051130369,dniaslsbila,,Before i wake ,Fri Apr 08 15:32:59 +0000 2016,2998199328,1460129579924,290,2998199328,Before i wake 
48,718462300810829824,serenityellen98,,I keep having the same dream over and over and I have it in the morning right before I wake up,Fri Apr 08 15:35:35 +0000 2016,1199163776,1460129735554,781,1199163776,I keep having the same dream over and over and I have it in the morning right before I wake up
49,718462691946287105,aina_nano,,RT @anissyafira_: Before I wake or Jungle book? Cepat pilih,Fri Apr 08 15:37:08 +0000 2016,1527318696,1460129828808,313,1527318696,RT @anissyafira_: Before I wake or Jungle book? Cepat pilih
50,718464019837812736,shxhyra,,RT @SAIFYZERO: #BeforeIWake @BeforeIWakeFilm amazing movie ,Fri Apr 08 15:42:25 +0000 2016,814788559,1460130145402,2374,814788559,RT @SAIFYZERO: #BeforeIWake @BeforeIWakeFilm amazing movie 
51,718464332028203008,simonhyypia_,,"........if i die before i wake, pray the lord my soul to keept. Selamat tidur",Fri Apr 08 15:43:39 +0000 2016,779576887,1460130219834,620,779576887,"........if i die before i wake, pray the lord my soul to keept. Selamat tidur"
52,718465419175006208,shxhyra,,"RT @TanJiaHong: Thanks @klipsmalaysia for #PremiereScreening #BeforeIWake
#KLIPSmy #TGVCinemas https://t.co/2A0IqTe5oP",Fri Apr 08 15:47:59 +0000 2016,814788559,1460130479030,2374,814788559,"RT @TanJiaHong: Thanks @klipsmalaysia for #PremiereScreening #BeforeIWake
#KLIPSmy #TGVCinemas https://t.co/2A0IqTe5oP"
53,718465533134249984,shxhyra,,RT @MVPIndia: Tweet your scariest nightmares &amp; share details https://t.co/jgKVipAK7z. Attend preview of #BeforeIWake  Mumbai *T&amp;CA https://,Fri Apr 08 15:48:26 +0000 2016,814788559,1460130506200,2374,814788559,RT @MVPIndia: Tweet your scariest nightmares &amp; share details https://t.co/jgKVipAK7z. Attend preview of #BeforeIWake  Mumbai *T&amp;CA https://
54,718465601249742848,shxhyra,,RT @GhostTalks_: Update: I've now chosen my title!!! #BeforeIWake,Fri Apr 08 15:48:42 +0000 2016,814788559,1460130522440,2374,814788559,RT @GhostTalks_: Update: I've now chosen my title!!! #BeforeIWake
55,718466589465509889,shxhyra,,"#beforeIwake movie of about the 
strong hearted of women who have 
lost her son and son who brave enough 
to be alone on lost of his mom.",Fri Apr 08 15:52:38 +0000 2016,814788559,1460130758049,2374,814788559,"#beforeIwake movie of about the 
strong hearted of women who have 
lost her son and son who brave enough 
to be alone on lost of his mom."
56,718466883419131905,NadhrahMahfar,,"RT @shxhyra: #beforeIwake movie of about the 
strong hearted of women who have 
lost her son and son who brave enough 
to be alone on lost",Fri Apr 08 15:53:48 +0000 2016,1690969952,1460130828133,151,1690969952,"RT @shxhyra: #beforeIwake movie of about the 
strong hearted of women who have 
lost her son and son who brave enough 
to be alone on lost"
57,718468263236149249,edyayayayoyoi,,Before I Wake has a very unique storyline.,Fri Apr 08 15:59:17 +0000 2016,752928594,1460131157107,483,752928594,Before I Wake has a very unique storyline.
58,718469417646993408,thefyraaa,,Before i wake rn,Fri Apr 08 16:03:52 +0000 2016,244086263,1460131432340,719,244086263,Before i wake rn
59,718469519895851010,jiayeng26,,"Before I wake  (at @TGVCinemas in Kepong, Kuala Lumpur w/ @jiaqi0730) https://t.co/91EW4SfD9v",Fri Apr 08 16:04:16 +0000 2016,496865807,1460131456718,296,496865807,"Before I wake  (at @TGVCinemas in Kepong, Kuala Lumpur w/ @jiaqi0730) https://t.co/91EW4SfD9v"
60,718469834304933888,precioushorror,,If I die before I wake I pray a real makeup artist does my makeup so I can be fleeky af when y'all pull up to my coffin .,Fri Apr 08 16:05:31 +0000 2016,293754412,1460131531679,489,293754412,If I die before I wake I pray a real makeup artist does my makeup so I can be fleeky af when y'all pull up to my coffin .
61,718469890047352832,javascriptisez,,"This Rotten Week: Predicting Bernie Sanders, The Boss And Before I Wake Reviews #fakeheadlinebot #learntocode #makeatwitterbot #javascript",Fri Apr 08 16:05:44 +0000 2016,4382400263,1460131544969,213,4382400263,"This Rotten Week: Predicting Bernie Sanders, The Boss And Before I Wake Reviews #fakeheadlinebot #learntocode #makeatwitterbot #javascript"
62,718471077018648577,JusticeWilkie,,If i die before i wake. I pray the lord my soul to take. ,Fri Apr 08 16:10:27 +0000 2016,588060528,1460131827965,366,588060528,If i die before i wake. I pray the lord my soul to take. 
63,718472030916444160,_nssmh,,@anissyafira_ before i wake,Fri Apr 08 16:14:15 +0000 2016,3024229166,1460132055392,52,3024229166,@anissyafira_ before i wake
64,718472828517941248,cyyntia_sv,,SOMNIA ANTES DE DESPERTAR / BEFORE I WAKE - Trailer https://t.co/ZgEvovSVFn,Fri Apr 08 16:17:25 +0000 2016,243078873,1460132245555,152,243078873,SOMNIA ANTES DE DESPERTAR / BEFORE I WAKE - Trailer https://t.co/ZgEvovSVFn
65,718475263336525824,MelissaSaraEcha,,"Cutest muvee ever, before I wake. Cody ",Fri Apr 08 16:27:06 +0000 2016,148330591,1460132826061,785,148330591,"Cutest muvee ever, before I wake. Cody "
66,718477723874660353,blooddancing,,My family frequently does this thing where they disappear before I wake up,Fri Apr 08 16:36:52 +0000 2016,1597528916,1460133412699,480,1597528916,My family frequently does this thing where they disappear before I wake up
67,718479001463975937,FlubKingOff,,"How come every time before I wake up, I have a dream like ""Oh i won a million dollars"". When I wake up though, I never did ;--;

#Mutiny",Fri Apr 08 16:41:57 +0000 2016,4280053354,1460133717300,35,4280053354,"How come every time before I wake up, I have a dream like ""Oh i won a million dollars"". When I wake up though, I never did ;--;

#Mutiny"
68,718479159547338752,tj_yaremchak21,,"RT @FlubKingOff: How come every time before I wake up, I have a dream like ""Oh i won a million dollars"". When I wake up though, I never did",Fri Apr 08 16:42:34 +0000 2016,4638554303,1460133754990,10,4638554303,"RT @FlubKingOff: How come every time before I wake up, I have a dream like ""Oh i won a million dollars"". When I wake up though, I never did"
69,718480398678757380,hishamoktar,,@syazaameera wuu. tengok cerita before i wake. nightmare pasal butterfly,Fri Apr 08 16:47:30 +0000 2016,561054395,1460134050422,355,561054395,@syazaameera wuu. tengok cerita before i wake. nightmare pasal butterfly
70,718481681951428608,shelbylynn1300,,"RT @FlubKingOff: How come every time before I wake up, I have a dream like ""Oh i won a million dollars"". When I wake up though, I never did",Fri Apr 08 16:52:36 +0000 2016,2558043941,1460134356378,221,2558043941,"RT @FlubKingOff: How come every time before I wake up, I have a dream like ""Oh i won a million dollars"". When I wake up though, I never did"
71,718482159036731392,minet0ad0re,,IF I DIE BEFORE I WAKE AT LEAST IN HEAVEN I CAN SKATE CAUSE RIGHT NOW ON EARTH I CANT DO SHIT,Fri Apr 08 16:54:30 +0000 2016,455737467,1460134470124,1740,455737467,IF I DIE BEFORE I WAKE AT LEAST IN HEAVEN I CAN SKATE CAUSE RIGHT NOW ON EARTH I CANT DO SHIT
72,718482436246495233,nasser_mo3gza,,"I added a video to a @YouTube playlist https://t.co/uRqaB1MjqI Before I Wake Official Trailer #1 (2015) - Kate Bosworth, Thomas Jane",Fri Apr 08 16:55:36 +0000 2016,439373778,1460134536216,7740,439373778,"I added a video to a @YouTube playlist https://t.co/uRqaB1MjqI Before I Wake Official Trailer #1 (2015) - Kate Bosworth, Thomas Jane"
73,718483753987772416,fiqahmsa,,Before I Wake Up  was really really good ,Fri Apr 08 17:00:50 +0000 2016,3269136104,1460134850390,301,3269136104,Before I Wake Up  was really really good 
74,718488148582473728,mavigoddes,,before I wake https://t.co/aPJG7V00cg,Fri Apr 08 17:18:18 +0000 2016,539861523,1460135898143,608,539861523,before I wake https://t.co/aPJG7V00cg
75,718490789764935681,Modelbound_,,If I should die before I wake it's cause you took my breath away.,Fri Apr 08 17:28:47 +0000 2016,228800398,1460136527850,1497,228800398,If I should die before I wake it's cause you took my breath away.
76,718491381988253696,ian_sandwell,,@JonathanHatfull It'll pass the time until Before I Wake (his feature after Oculus) *finally* gets a release one day.,Fri Apr 08 17:31:09 +0000 2016,533393020,1460136669047,1351,533393020,@JonathanHatfull It'll pass the time until Before I Wake (his feature after Oculus) *finally* gets a release one day.
77,718491629624004608,nfrzna_,,thumbs up fr Before I Wake ihiks I rate it abt 8/10 hahahahaha,Fri Apr 08 17:32:08 +0000 2016,408209732,1460136728088,1434,408209732,thumbs up fr Before I Wake ihiks I rate it abt 8/10 hahahahaha
78,718491794623766530,_ehsn,,The boy in 'before I wake' is soooo cute!,Fri Apr 08 17:32:47 +0000 2016,444403586,1460136767427,200,444403586,The boy in 'before I wake' is soooo cute!
79,718491857370685440,roboko_001,,"Now I lay me back to sleep.The speaker's dull; the subject's deep.If he should stop before I wake,Give me a nudge for go",Fri Apr 08 17:33:02 +0000 2016,1016412212,1460136782387,271,1016412212,"Now I lay me back to sleep.The speaker's dull; the subject's deep.If he should stop before I wake,Give me a nudge for go"
80,718493198339846144,JlegoJ,,There should be a required trigger warning before I wake up every morning.,Fri Apr 08 17:38:22 +0000 2016,1697311958,1460137102099,141,1697311958,There should be a required trigger warning before I wake up every morning.
81,718493423448276996,lowdy_5,,before i wake,Fri Apr 08 17:39:15 +0000 2016,1147709886,1460137155769,648,1147709886,before i wake
82,718493777636302849,damian_wiecha,,"@flanaganfilm @TheNewtonBros Hello , BROTHERS :) WHEN SOUNDTRACK Before I Wake :)",Fri Apr 08 17:40:40 +0000 2016,3097488568,1460137240214,266,3097488568,"@flanaganfilm @TheNewtonBros Hello , BROTHERS :) WHEN SOUNDTRACK Before I Wake :)"
83,718494104116535296,AZIXIZA,,"""If I should die before I wake, it's 'cause you took my breath away..""",Fri Apr 08 17:41:58 +0000 2016,3368652912,1460137318053,46,3368652912,"""If I should die before I wake, it's 'cause you took my breath away.."""
84,718494202242334721,LastTweetsLOL,,"If I die before I wake, I pray the lord will hide my porn.#LastTweetsLOL  #lol",Fri Apr 08 17:42:21 +0000 2016,1217754282,1460137341448,279,1217754282,"If I die before I wake, I pray the lord will hide my porn.#LastTweetsLOL  #lol"
85,718497316559126528,alyamirn,,"Ive never cried watching a movie as much as I just cried during ""Before i wake"".the shit was so real !!",Fri Apr 08 17:54:43 +0000 2016,867835639,1460138083959,3199,867835639,"Ive never cried watching a movie as much as I just cried during ""Before i wake"".the shit was so real !!"
86,718500395706904576,SheenAlhajrei,,Before I wake.,Fri Apr 08 18:06:58 +0000 2016,1200738326,1460138818085,927,1200738326,Before I wake.
87,718501057802862592,LGremler,,RT @JlegoJ: There should be a required trigger warning before I wake up every morning.,Fri Apr 08 18:09:35 +0000 2016,399018579,1460138975941,251,399018579,RT @JlegoJ: There should be a required trigger warning before I wake up every morning.
88,718501930725564416,ILEANAGEORGINA,,If I die before I wake promise me you'll remember me tomorrow cause I remember yooooou,Fri Apr 08 18:13:04 +0000 2016,4472878525,1460139184062,317,4472878525,If I die before I wake promise me you'll remember me tomorrow cause I remember yooooou
89,718502969985994753,civenevici,,"If I die before I wake, I pray the lord will hide my porn.",Fri Apr 08 18:17:11 +0000 2016,2236016516,1460139431841,17,2236016516,"If I die before I wake, I pray the lord will hide my porn."
90,718503359699906562,dhaheriez__,,before i wake,Fri Apr 08 18:18:44 +0000 2016,487899509,1460139524756,1506,487899509,before i wake
91,718503429199564800,billycornish6,,If I should die before I wake. please dont draw any dicks on my face.,Fri Apr 08 18:19:01 +0000 2016,717761575122288640,1460139541326,67,717761575122288640,If I should die before I wake. please dont draw any dicks on my face.
92,718503525316239360,theoriginaltoon,,If I shall die before I wake pray the lord take my soul,Fri Apr 08 18:19:24 +0000 2016,2381178230,1460139564242,196,2381178230,If I shall die before I wake pray the lord take my soul
93,718504317955743744,YES_IMA_BLASIAN,,"RT @shabriasemone: And if I die before I wake, I pray the lord my soul to take",Fri Apr 08 18:22:33 +0000 2016,465322785,1460139753222,1399,465322785,"RT @shabriasemone: And if I die before I wake, I pray the lord my soul to take"
94,718504365737291777,xoxo_leahmfs,,"RT @shabriasemone: And if I die before I wake, I pray the lord my soul to take",Fri Apr 08 18:22:44 +0000 2016,405590791,1460139764614,917,405590791,"RT @shabriasemone: And if I die before I wake, I pray the lord my soul to take"
95,718505550061940737,SaintsOrDemons,,"""If the Lord should come for me before I wake I wouldnt want to go if I cant see your face, cant hold you close.. https://t.co/OFyZGSeULa",Fri Apr 08 18:27:26 +0000 2016,427872540,1460140046979,2675,427872540,"""If the Lord should come for me before I wake I wouldnt want to go if I cant see your face, cant hold you close.. https://t.co/OFyZGSeULa"
