index,id,user_screen_name,name,text,created_at,userid,timestamp_ms,followers_count,userid_str,text_1
96,718507871584010240,kenna_OAM,,Biggie Smalls - If I should Die Before I Wake,Fri Apr 08 18:36:40 +0000 2016,45173042,1460140600473,482,45173042,Biggie Smalls - If I should Die Before I Wake
97,718508596917448705,a_naqib21,,Before I Wake cenggini ,Fri Apr 08 18:39:33 +0000 2016,2787834415,1460140773406,140,2787834415,Before I Wake cenggini 
98,718509810866634754,MartinasDenisa,,if i die before i wake hope i don't come back a slave https://t.co/akrwaUsRd0,Fri Apr 08 18:44:22 +0000 2016,1712579402,1460141062834,123,1712579402,if i die before i wake hope i don't come back a slave https://t.co/akrwaUsRd0
99,718511304722497536,We_Are_Titans_,,"RT @JarettSays: And now I lay me down to sleep
I pray the lord my soul to keep
And if I die before I wake
They better have Beyonce's new al",Fri Apr 08 18:50:18 +0000 2016,910845216,1460141418997,478,910845216,"RT @JarettSays: And now I lay me down to sleep
I pray the lord my soul to keep
And if I die before I wake
They better have Beyonce's new al"
100,718512786066812928,Bittersweetmatt,,RT @DerekLuh: Now I lay me down to sleep I pray the lord my soul to keep..If I should die before I wake I pray the Lord my soul to take..,Fri Apr 08 18:56:12 +0000 2016,2766682235,1460141772177,1622,2766682235,RT @DerekLuh: Now I lay me down to sleep I pray the lord my soul to keep..If I should die before I wake I pray the Lord my soul to take..
101,718513305925459968,colliderfrosty,,".@flanaganfilm and Kate Siegel on Hush, Before I Wake and Ouija 2 https://t.co/MTWnA2ExXy https://t.co/6yaTc4UUWo",Fri Apr 08 18:58:16 +0000 2016,17771425,1460141896121,39108,17771425,".@flanaganfilm and Kate Siegel on Hush, Before I Wake and Ouija 2 https://t.co/MTWnA2ExXy https://t.co/6yaTc4UUWo"
102,718513451916750848,PeekabooBlondie,,@_13Chris @ThatJoser @beadybass @katlong31 @jules_humphrey @_Marebear I know! Someone put on my makeup &amp; do my hair before I wake up dammit!,Fri Apr 08 18:58:50 +0000 2016,30266709,1460141930928,2197,30266709,@_13Chris @ThatJoser @beadybass @katlong31 @jules_humphrey @_Marebear I know! Someone put on my makeup &amp; do my hair before I wake up dammit!
103,718514630172241920,tugrockz99,,Yo it's the 8th. Why can't I find any tickets for Before I Wake https://t.co/R1BSZQ7Uy1,Fri Apr 08 19:03:31 +0000 2016,452744933,1460142211846,349,452744933,Yo it's the 8th. Why can't I find any tickets for Before I Wake https://t.co/R1BSZQ7Uy1
104,718515170218287105,infomediadotcom,,The new movie Before I Wake comes out today about a boy whos scared to fall asleep. Any of you developers relate? 1. More. Line. Of code.,Fri Apr 08 19:05:40 +0000 2016,28584164,1460142340603,1990,28584164,The new movie Before I Wake comes out today about a boy whos scared to fall asleep. Any of you developers relate? 1. More. Line. Of code.
105,718515510040784897,Noranuggett,,"Before i wake was amaaaazing , it's not just a horror film the story was great too and jacob tremblay is the best child actor i've ever seen",Fri Apr 08 19:07:01 +0000 2016,850047746,1460142421623,103,850047746,"Before i wake was amaaaazing , it's not just a horror film the story was great too and jacob tremblay is the best child actor i've ever seen"
