index,id,user_screen_name,name,text,created_at,userid,timestamp_ms,followers_count,userid_str,text_1
1,720741123711340544,camachogabe,,@JeremyJahns are you still going to do a Hardcore Henry review?,Thu Apr 14 22:30:49 +0000 2016,1131518180,1460673049272,187,1131518180,@JeremyJahns are you still going to do a Hardcore Henry review?
2,720741132125253632,the1philmorley,,Can't wait to play the tie-in video game for Hardcore Henry.,Thu Apr 14 22:30:51 +0000 2016,19246199,1460673051278,310,19246199,Can't wait to play the tie-in video game for Hardcore Henry.
3,720741211229790212,reelreviewstv,,Reel Reviews The Boss/Demolition/Hardcore Henry: https://t.co/dY2zZSCLEV via @YouTube,Thu Apr 14 22:31:10 +0000 2016,2559777442,1460673070138,125,2559777442,Reel Reviews The Boss/Demolition/Hardcore Henry: https://t.co/dY2zZSCLEV via @YouTube
4,720741291320078337,reppep,,"I thought Hardcore Henry was scifi action, but the previews before it are all grotty horror",Thu Apr 14 22:31:29 +0000 2016,9100032,1460673089233,408,9100032,"I thought Hardcore Henry was scifi action, but the previews before it are all grotty horror"
5,720741387612864512,NatasjaEPB,,"So I saw #HardcoreHenry tonight. Not bad. Not bad at all. Wasn't expecting that, so I'm pleasantly surprised ",Thu Apr 14 22:31:52 +0000 2016,1473134574,1460673112191,405,1473134574,"So I saw #HardcoreHenry tonight. Not bad. Not bad at all. Wasn't expecting that, so I'm pleasantly surprised "
6,720741607524335616,mikelaneisme,,"I wrote a review on ""Hardcore Henry,"" you know, that first-person action flick. Read it here: https://t.co/CQThhMIM9g",Thu Apr 14 22:32:44 +0000 2016,1075291164,1460673164622,165,1075291164,"I wrote a review on ""Hardcore Henry,"" you know, that first-person action flick. Read it here: https://t.co/CQThhMIM9g"
7,720742588786065409,NatasjaEPB,,"RT @Cinemark: The mayhem is real. #HardcoreHenry is now playing! Grab your tickets now: https://t.co/C2Bqelnaon
https://t.co/8AaIaVKaTD",Thu Apr 14 22:36:38 +0000 2016,1473134574,1460673398573,405,1473134574,"RT @Cinemark: The mayhem is real. #HardcoreHenry is now playing! Grab your tickets now: https://t.co/C2Bqelnaon
https://t.co/8AaIaVKaTD"
8,720742692611825665,NatasjaEPB,,"RT @HardcoreHenry: Be part of a cinematic revolution. #HardcoreHenry, NOW PLAYING only in theaters. Get tix: https://t.co/QF9KK1JQLJ https:",Thu Apr 14 22:37:03 +0000 2016,1473134574,1460673423327,405,1473134574,"RT @HardcoreHenry: Be part of a cinematic revolution. #HardcoreHenry, NOW PLAYING only in theaters. Get tix: https://t.co/QF9KK1JQLJ https:"
9,720742714770206720,wjkinslow,,So is @HardcoreHenry @HowToBasic?,Thu Apr 14 22:37:08 +0000 2016,1717640876,1460673428610,1225,1717640876,So is @HardcoreHenry @HowToBasic?
10,720742793753337857,Jayms_Wisdom,,#HardcoreHenry is exactly the film you'd expect. A ridiculous action romp that's a bit too long and not easy to watch. #weeklyfilmtweet,Thu Apr 14 22:37:27 +0000 2016,303913992,1460673447441,86,303913992,#HardcoreHenry is exactly the film you'd expect. A ridiculous action romp that's a bit too long and not easy to watch. #weeklyfilmtweet
11,720743077653192705,chunkynoseblood,,so eddie the eagle is actually a decent film and hardcore henry descended into enjoyable violent madness,Thu Apr 14 22:38:35 +0000 2016,104931756,1460673515128,145,104931756,so eddie the eagle is actually a decent film and hardcore henry descended into enjoyable violent madness
12,720743119537483778,ZombieSorcerer,,I liked a @YouTube video from @comicsjls https://t.co/uCpUhOZpbD Hardcore Henry Movie Review! (Plus a brief re-enactment ... Of sorts),Thu Apr 14 22:38:45 +0000 2016,133884100,1460673525114,387,133884100,I liked a @YouTube video from @comicsjls https://t.co/uCpUhOZpbD Hardcore Henry Movie Review! (Plus a brief re-enactment ... Of sorts)
13,720743173732098048,PSmith235,,watching Hardcore Henry at Cineworld Southampton https://t.co/W1IcNglX6b,Thu Apr 14 22:38:58 +0000 2016,211531937,1460673538035,37,211531937,watching Hardcore Henry at Cineworld Southampton https://t.co/W1IcNglX6b
14,720743466746167296,JoshRyuk,,Just saw Hardcore Henry. What a disappointing movie. Some parts were kinda neat but overall... Meh.,Thu Apr 14 22:40:07 +0000 2016,2317460959,1460673607895,61,2317460959,Just saw Hardcore Henry. What a disappointing movie. Some parts were kinda neat but overall... Meh.
15,720743675509215233,randomartist42,,I liked a @YouTube video https://t.co/0h2uBMgjAd Half in the Bag Episode 107: Hardcore Henry,Thu Apr 14 22:40:57 +0000 2016,51248754,1460673657668,302,51248754,I liked a @YouTube video https://t.co/0h2uBMgjAd Half in the Bag Episode 107: Hardcore Henry
16,720743709248266240,randomartist42,,I added a video to a @YouTube playlist https://t.co/0h2uBMgjAd Half in the Bag Episode 107: Hardcore Henry,Thu Apr 14 22:41:05 +0000 2016,51248754,1460673665712,302,51248754,I added a video to a @YouTube playlist https://t.co/0h2uBMgjAd Half in the Bag Episode 107: Hardcore Henry
17,720743802219008000,minatox18,,At the movies with my brother about to watch hardcore Henry! #sibling #brobondingtime https://t.co/DsZIovBHUN,Thu Apr 14 22:41:27 +0000 2016,2903956765,1460673687878,7,2903956765,At the movies with my brother about to watch hardcore Henry! #sibling #brobondingtime https://t.co/DsZIovBHUN
18,720743896372944896,PaddieT,,#hardcorehenry was brilliant. Some amazing incredible action and @sharlto copley was great in it!,Thu Apr 14 22:41:50 +0000 2016,53013112,1460673710326,83,53013112,#hardcorehenry was brilliant. Some amazing incredible action and @sharlto copley was great in it!
19,720744259234738177,mondoharpo,,"HARDCORE HENRY somehow simultaneously inventive and fresh and incredibly derivative and stale. Style over substance, just didn't work for me",Thu Apr 14 22:43:16 +0000 2016,161635584,1460673796839,180,161635584,"HARDCORE HENRY somehow simultaneously inventive and fresh and incredibly derivative and stale. Style over substance, just didn't work for me"
20,720744275550580736,sweetstorybro,,RT @openallpowers: Check out my SPOILER FREE written REVIEW of #HardcoreHenry https://t.co/BdsC2nCml6 #podernfamily #review #movie #podcast,Thu Apr 14 22:43:20 +0000 2016,3828376222,1460673800729,134,3828376222,RT @openallpowers: Check out my SPOILER FREE written REVIEW of #HardcoreHenry https://t.co/BdsC2nCml6 #podernfamily #review #movie #podcast
21,720744295641255936,MiiCK3Y,,Half way through #HardcoreHenry and I'm dizzy lol,Thu Apr 14 22:43:25 +0000 2016,23768563,1460673805519,943,23768563,Half way through #HardcoreHenry and I'm dizzy lol
22,720744644049575938,lommym,,"RT @jeffgerstmann: Hardcore Henry also seems extra dumb on a movie screen. Should've been released as a 240p-only YT video, ripped and reup",Thu Apr 14 22:44:48 +0000 2016,20439814,1460673888586,131,20439814,"RT @jeffgerstmann: Hardcore Henry also seems extra dumb on a movie screen. Should've been released as a 240p-only YT video, ripped and reup"
23,720745164399124480,TanitPhoenix,,Playing with my husband #hobo #hardcorehenry #tanitphoenix https://t.co/jNUb9wkZXn,Thu Apr 14 22:46:52 +0000 2016,60840734,1460674012647,18590,60840734,Playing with my husband #hobo #hardcorehenry #tanitphoenix https://t.co/jNUb9wkZXn
24,720745317843525632,Chloe_Stubbs,,If you like action movies... go watch #HardcoreHenry. I cannot even comprehend what I have just watched. #Crazy #NoChill #Amazing,Thu Apr 14 22:47:29 +0000 2016,46085715,1460674049231,543,46085715,If you like action movies... go watch #HardcoreHenry. I cannot even comprehend what I have just watched. #Crazy #NoChill #Amazing
25,720745488803373058,pcgamer,,"Hardcore Henry can be fun, but videogames and filmmaking still mix poorly https://t.co/gW5ugHLJ36 https://t.co/NsQC5O03Fv",Thu Apr 14 22:48:09 +0000 2016,16736535,1460674089991,1086825,16736535,"Hardcore Henry can be fun, but videogames and filmmaking still mix poorly https://t.co/gW5ugHLJ36 https://t.co/NsQC5O03Fv"
26,720745566171324416,HeyItsWillmore,,"RT @pcgamer: Hardcore Henry can be fun, but videogames and filmmaking still mix poorly https://t.co/gW5ugHLJ36 https://t.co/NsQC5O03Fv",Thu Apr 14 22:48:28 +0000 2016,715480540988645376,1460674108437,19,715480540988645376,"RT @pcgamer: Hardcore Henry can be fun, but videogames and filmmaking still mix poorly https://t.co/gW5ugHLJ36 https://t.co/NsQC5O03Fv"
27,720745587717443584,Pey10_Weaver,,Hardcore Henry is such an epic movie! ,Thu Apr 14 22:48:33 +0000 2016,721061322,1460674113574,154,721061322,Hardcore Henry is such an epic movie! 
28,720745639949131776,whdlf1177,,"RT @pcgamer: Hardcore Henry can be fun, but videogames and filmmaking still mix poorly https://t.co/gW5ugHLJ36 https://t.co/NsQC5O03Fv",Thu Apr 14 22:48:46 +0000 2016,1494113286,1460674126027,168,1494113286,"RT @pcgamer: Hardcore Henry can be fun, but videogames and filmmaking still mix poorly https://t.co/gW5ugHLJ36 https://t.co/NsQC5O03Fv"
29,720745674644410368,AggroQueenFay,,"RT @pcgamer: Hardcore Henry can be fun, but videogames and filmmaking still mix poorly https://t.co/gW5ugHLJ36 https://t.co/NsQC5O03Fv",Thu Apr 14 22:48:54 +0000 2016,56566855,1460674134299,485,56566855,"RT @pcgamer: Hardcore Henry can be fun, but videogames and filmmaking still mix poorly https://t.co/gW5ugHLJ36 https://t.co/NsQC5O03Fv"
30,720745766994722816,GhostKetzer,,"RT @pcgamer: Hardcore Henry can be fun, but videogames and filmmaking still mix poorly https://t.co/gW5ugHLJ36 https://t.co/NsQC5O03Fv",Thu Apr 14 22:49:16 +0000 2016,1183096537,1460674156317,178,1183096537,"RT @pcgamer: Hardcore Henry can be fun, but videogames and filmmaking still mix poorly https://t.co/gW5ugHLJ36 https://t.co/NsQC5O03Fv"
31,720745912612429825,Mr_Penguin_Guy,,"RT @pcgamer: Hardcore Henry can be fun, but videogames and filmmaking still mix poorly https://t.co/gW5ugHLJ36 https://t.co/NsQC5O03Fv",Thu Apr 14 22:49:51 +0000 2016,458179663,1460674191035,34,458179663,"RT @pcgamer: Hardcore Henry can be fun, but videogames and filmmaking still mix poorly https://t.co/gW5ugHLJ36 https://t.co/NsQC5O03Fv"
32,720745913975746560,mysamples,,Win the Ultimate Gamers Prize Pack from HARDCORE HENRY https://t.co/86Etk9KUM6,Thu Apr 14 22:49:51 +0000 2016,84007467,1460674191360,1623,84007467,Win the Ultimate Gamers Prize Pack from HARDCORE HENRY https://t.co/86Etk9KUM6
33,720745951636385792,TheJizzo,,YWJ Entertainment:- Hardcore Henry Review: https://t.co/A8ckLwY64b via @YouTube,Thu Apr 14 22:50:00 +0000 2016,46958189,1460674200339,219,46958189,YWJ Entertainment:- Hardcore Henry Review: https://t.co/A8ckLwY64b via @YouTube
34,720745991389839361,TanitPhoenix,,"Playing with my husband, the onset hobo #hobo #russia #hardcorehenry #sharltocopley  https://t.co/3ejsmUYJOR",Thu Apr 14 22:50:09 +0000 2016,60840734,1460674209817,18592,60840734,"Playing with my husband, the onset hobo #hobo #russia #hardcorehenry #sharltocopley  https://t.co/3ejsmUYJOR"
35,720746022545141760,ChaoticMessTV,,"RT @pcgamer: Hardcore Henry can be fun, but videogames and filmmaking still mix poorly https://t.co/gW5ugHLJ36 https://t.co/NsQC5O03Fv",Thu Apr 14 22:50:17 +0000 2016,719973113757364224,1460674217245,35,719973113757364224,"RT @pcgamer: Hardcore Henry can be fun, but videogames and filmmaking still mix poorly https://t.co/gW5ugHLJ36 https://t.co/NsQC5O03Fv"
36,720746340251213825,PCgamebundle,,"RT pcgamer: Hardcore Henry can be fun, but videogames and filmmaking still mix poorly https://t.co/pyXPsyA5gk https://t.co/vLFB2n60TG",Thu Apr 14 22:51:32 +0000 2016,3041411783,1460674292992,175,3041411783,"RT pcgamer: Hardcore Henry can be fun, but videogames and filmmaking still mix poorly https://t.co/pyXPsyA5gk https://t.co/vLFB2n60TG"
37,720746362229366784,PCgamebundle,,"RT pcgamer: Hardcore Henry can be fun, but videogames and filmmaking still mix poorly https://t.co/pyXPsyA5gk... https://t.co/pvHiWG6u71",Thu Apr 14 22:51:38 +0000 2016,3041411783,1460674298232,175,3041411783,"RT pcgamer: Hardcore Henry can be fun, but videogames and filmmaking still mix poorly https://t.co/pyXPsyA5gk... https://t.co/pvHiWG6u71"
38,720746454617321472,GameHawkTheApp,,"RT @pcgamer: Hardcore Henry can be fun, but videogames and filmmaking still mix poorly https://t.co/gW5ugHLJ36 https://t.co/NsQC5O03Fv",Thu Apr 14 22:52:00 +0000 2016,2438498726,1460674320259,399,2438498726,"RT @pcgamer: Hardcore Henry can be fun, but videogames and filmmaking still mix poorly https://t.co/gW5ugHLJ36 https://t.co/NsQC5O03Fv"
39,720746459402874881,PizzaCube,,"RT @pcgamer: Hardcore Henry can be fun, but videogames and filmmaking still mix poorly https://t.co/gW5ugHLJ36 https://t.co/NsQC5O03Fv",Thu Apr 14 22:52:01 +0000 2016,1579244930,1460674321400,783,1579244930,"RT @pcgamer: Hardcore Henry can be fun, but videogames and filmmaking still mix poorly https://t.co/gW5ugHLJ36 https://t.co/NsQC5O03Fv"
40,720746826371067904,___WiN_NeR___,,"RT @pcgamer: Hardcore Henry can be fun, but videogames and filmmaking still mix poorly https://t.co/gW5ugHLJ36 https://t.co/NsQC5O03Fv",Thu Apr 14 22:53:28 +0000 2016,2877907379,1460674408892,36,2877907379,"RT @pcgamer: Hardcore Henry can be fun, but videogames and filmmaking still mix poorly https://t.co/gW5ugHLJ36 https://t.co/NsQC5O03Fv"
41,720746975163846657,tkyk0922,,"RT @pcgamer: Hardcore Henry can be fun, but videogames and filmmaking still mix poorly https://t.co/gW5ugHLJ36 https://t.co/NsQC5O03Fv",Thu Apr 14 22:54:04 +0000 2016,59041007,1460674444367,1028,59041007,"RT @pcgamer: Hardcore Henry can be fun, but videogames and filmmaking still mix poorly https://t.co/gW5ugHLJ36 https://t.co/NsQC5O03Fv"
42,720746987352555521,ALphaEXray,,"Takes a bit of getting used to, but fans of FPS games will enjoy #HardcoreHenry https://t.co/7XSWitXcXG https://t.co/7iesAcYXDE",Thu Apr 14 22:54:07 +0000 2016,97360260,1460674447273,34,97360260,"Takes a bit of getting used to, but fans of FPS games will enjoy #HardcoreHenry https://t.co/7XSWitXcXG https://t.co/7iesAcYXDE"
43,720747031359315968,Reapergrrimm,,"RT @pcgamer: Hardcore Henry can be fun, but videogames and filmmaking still mix poorly https://t.co/gW5ugHLJ36 https://t.co/NsQC5O03Fv",Thu Apr 14 22:54:17 +0000 2016,2474365910,1460674457765,162,2474365910,"RT @pcgamer: Hardcore Henry can be fun, but videogames and filmmaking still mix poorly https://t.co/gW5ugHLJ36 https://t.co/NsQC5O03Fv"
44,720747520066859008,zathomas1930,,Hardcore Henry is a 9/10 for me,Thu Apr 14 22:56:14 +0000 2016,188718956,1460674574282,18738,188718956,Hardcore Henry is a 9/10 for me
45,720747567340986369,VoltySquirrel,,I liked a @YouTube video https://t.co/Bfqt8c9gIU Half in the Bag Episode 107: Hardcore Henry,Thu Apr 14 22:56:25 +0000 2016,25588636,1460674585553,454,25588636,I liked a @YouTube video https://t.co/Bfqt8c9gIU Half in the Bag Episode 107: Hardcore Henry
46,720747896585527297,Crowy26chloe,,"RT @pcgamer: Hardcore Henry can be fun, but videogames and filmmaking still mix poorly https://t.co/gW5ugHLJ36 https://t.co/NsQC5O03Fv",Thu Apr 14 22:57:44 +0000 2016,2440577382,1460674664051,75,2440577382,"RT @pcgamer: Hardcore Henry can be fun, but videogames and filmmaking still mix poorly https://t.co/gW5ugHLJ36 https://t.co/NsQC5O03Fv"
47,720747903786979328,Wolftonix,,"RT @pcgamer: Hardcore Henry can be fun, but videogames and filmmaking still mix poorly https://t.co/gW5ugHLJ36 https://t.co/NsQC5O03Fv",Thu Apr 14 22:57:45 +0000 2016,3115639734,1460674665768,2259,3115639734,"RT @pcgamer: Hardcore Henry can be fun, but videogames and filmmaking still mix poorly https://t.co/gW5ugHLJ36 https://t.co/NsQC5O03Fv"
48,720748085387747329,VoltySquirrel,,That RLM Hardcore Henry review is probably the best review Ive seen of the film.,Thu Apr 14 22:58:29 +0000 2016,25588636,1460674709065,454,25588636,That RLM Hardcore Henry review is probably the best review Ive seen of the film.
49,720748124034174976,Daysatthecinema,,"#hardcorehenry - It's simply dull.

Full review:
https://t.co/2wCupU0Xjh

#fps #sharltocopley #movies #videogames https://t.co/ZWvj1l7lH3",Thu Apr 14 22:58:38 +0000 2016,1056399523,1460674718279,7,1056399523,"#hardcorehenry - It's simply dull.

Full review:
https://t.co/2wCupU0Xjh

#fps #sharltocopley #movies #videogames https://t.co/ZWvj1l7lH3"
50,720748272781029376,shitforgamers,,"Hardcore Henry can be fun, but videogames and filmmaking still mix poorly https://t.co/rlcrI3V6tg https://t.co/yFmP3w04sb",Thu Apr 14 22:59:13 +0000 2016,3081938142,1460674753743,857,3081938142,"Hardcore Henry can be fun, but videogames and filmmaking still mix poorly https://t.co/rlcrI3V6tg https://t.co/yFmP3w04sb"
51,720748326115799045,Martin_Buckley,,Just saw Hardcore Henry. Po-faced critics wrong as usual. Remarkably cinematic mock-video game black comedy. Far better than awful Deadpool,Thu Apr 14 22:59:26 +0000 2016,88749861,1460674766459,89,88749861,Just saw Hardcore Henry. Po-faced critics wrong as usual. Remarkably cinematic mock-video game black comedy. Far better than awful Deadpool
52,720748511382228992,sttepodcast,,New #podcast! We review #HardcoreHenry and Sucker Punch: https://t.co/qlZv3Xd3mV #action #movie #film #cinema https://t.co/sfOOEkJztD,Thu Apr 14 23:00:10 +0000 2016,2709128076,1460674810630,32416,2709128076,New #podcast! We review #HardcoreHenry and Sucker Punch: https://t.co/qlZv3Xd3mV #action #movie #film #cinema https://t.co/sfOOEkJztD
53,720748587932450816,USNCDutch,,Half in the Bag Episode 107: Hardcore Henry https://t.co/M5dwLu37Gv via @YouTube,Thu Apr 14 23:00:28 +0000 2016,3311810478,1460674828881,84,3311810478,Half in the Bag Episode 107: Hardcore Henry https://t.co/M5dwLu37Gv via @YouTube
54,720749223004803072,EchoesOfHorror,,RT @sttepodcast: New #podcast! We review #HardcoreHenry and Sucker Punch: https://t.co/qlZv3Xd3mV #action #movie #film #cinema https://t.co,Thu Apr 14 23:03:00 +0000 2016,3040754502,1460674980294,4756,3040754502,RT @sttepodcast: New #podcast! We review #HardcoreHenry and Sucker Punch: https://t.co/qlZv3Xd3mV #action #movie #film #cinema https://t.co
55,720749308505694209,videogamesbot_,,"RT @pcgamer: Hardcore Henry can be fun, but videogames and filmmaking still mix poorly https://t.co/gW5ugHLJ36 https://t.co/NsQC5O03Fv",Thu Apr 14 23:03:20 +0000 2016,4691966654,1460675000679,1140,4691966654,"RT @pcgamer: Hardcore Henry can be fun, but videogames and filmmaking still mix poorly https://t.co/gW5ugHLJ36 https://t.co/NsQC5O03Fv"
56,720749405641420800,KBuenconcejo,,"RT @pcgamer: Hardcore Henry can be fun, but videogames and filmmaking still mix poorly https://t.co/gW5ugHLJ36 https://t.co/NsQC5O03Fv",Thu Apr 14 23:03:43 +0000 2016,2799659347,1460675023838,758,2799659347,"RT @pcgamer: Hardcore Henry can be fun, but videogames and filmmaking still mix poorly https://t.co/gW5ugHLJ36 https://t.co/NsQC5O03Fv"
57,720749683442860033,KyloMCRen,,RT @sttepodcast: New #podcast! We review #HardcoreHenry and Sucker Punch: https://t.co/qlZv3Xd3mV #action #movie #film #cinema https://t.co,Thu Apr 14 23:04:50 +0000 2016,3954960492,1460675090071,1773,3954960492,RT @sttepodcast: New #podcast! We review #HardcoreHenry and Sucker Punch: https://t.co/qlZv3Xd3mV #action #movie #film #cinema https://t.co
58,720749693232230400,geoffkeene,,Why are they calling Hardcore Henry a video game? It's just a first person movie. That doesn't make it a video game. https://t.co/uQJq7eDKYf,Thu Apr 14 23:04:52 +0000 2016,16230687,1460675092405,1992,16230687,Why are they calling Hardcore Henry a video game? It's just a first person movie. That doesn't make it a video game. https://t.co/uQJq7eDKYf
59,720749869086994432,hand_springs777,,"@Caddicarus saw Hardcore Henry just now, and one of the characters oddly reminded me of you in the current quickies videos",Thu Apr 14 23:05:34 +0000 2016,770188987,1460675134332,68,770188987,"@Caddicarus saw Hardcore Henry just now, and one of the characters oddly reminded me of you in the current quickies videos"
60,720750069624909824,scottinfukie,,RT @redlettermedia: Half in the Bag: Hardcore Henry: https://t.co/zZFZ4QOd7O,Thu Apr 14 23:06:22 +0000 2016,30192895,1460675182144,196,30192895,RT @redlettermedia: Half in the Bag: Hardcore Henry: https://t.co/zZFZ4QOd7O
61,720750115984683009,TheOtherMarioC,,@RegalMovies I'm getting #hardcoreatregal!! @HardcoreHenry https://t.co/CoVebaqxDt,Thu Apr 14 23:06:33 +0000 2016,15800855,1460675193197,2344,15800855,@RegalMovies I'm getting #hardcoreatregal!! @HardcoreHenry https://t.co/CoVebaqxDt
62,720750474174066692,DelochoDioses,,"RT @pcgamer: Hardcore Henry can be fun, but videogames and filmmaking still mix poorly https://t.co/gW5ugHLJ36 https://t.co/NsQC5O03Fv",Thu Apr 14 23:07:58 +0000 2016,906987644,1460675278596,763,906987644,"RT @pcgamer: Hardcore Henry can be fun, but videogames and filmmaking still mix poorly https://t.co/gW5ugHLJ36 https://t.co/NsQC5O03Fv"
63,720750574359212032,eric_boise,,RT @McJuggerNuggets: Yo. @HardcoreHenry is my new favorite movie. It was absolutely incredible. Not one second of boredom. Hilarious/Fast-p,Thu Apr 14 23:08:22 +0000 2016,4111916007,1460675302482,10,4111916007,RT @McJuggerNuggets: Yo. @HardcoreHenry is my new favorite movie. It was absolutely incredible. Not one second of boredom. Hilarious/Fast-p
64,720750694190465026,BipolarWreck90s,,Out to see @HardcoreHenry! #movienight,Thu Apr 14 23:08:51 +0000 2016,4738592515,1460675331052,18,4738592515,Out to see @HardcoreHenry! #movienight
65,720750739711225856,limanews,,Hardcore Henry  R https://t.co/IIVIXnhtwS,Thu Apr 14 23:09:01 +0000 2016,17502336,1460675341905,5702,17502336,Hardcore Henry  R https://t.co/IIVIXnhtwS
66,720750806883004417,MaxFlixUK,,MaxFlix: Hardcore Henry was recently added to Plex.,Thu Apr 14 23:09:17 +0000 2016,4871426602,1460675357920,3,4871426602,MaxFlix: Hardcore Henry was recently added to Plex.
67,720750956430954496,B_arakat,,"RT @pcgamer: Hardcore Henry can be fun, but videogames and filmmaking still mix poorly https://t.co/gW5ugHLJ36 https://t.co/NsQC5O03Fv",Thu Apr 14 23:09:53 +0000 2016,940148316,1460675393575,804,940148316,"RT @pcgamer: Hardcore Henry can be fun, but videogames and filmmaking still mix poorly https://t.co/gW5ugHLJ36 https://t.co/NsQC5O03Fv"
68,720750988513144833,reelComicHeroes,,RT @sttepodcast: New #podcast! We review #HardcoreHenry and Sucker Punch: https://t.co/qlZv3Xd3mV #action #movie #film #cinema https://t.co,Thu Apr 14 23:10:01 +0000 2016,3240298794,1460675401224,332,3240298794,RT @sttepodcast: New #podcast! We review #HardcoreHenry and Sucker Punch: https://t.co/qlZv3Xd3mV #action #movie #film #cinema https://t.co
69,720751108491190272,RobsLib,,"RT @dork74: Speedrun: ""Hardcore Henry"" in 60 seconds (s02ep02) 1A4 Studio-This is Brilliant!! @HardcoreHenry  https://t.co/xglVSiJN9o",Thu Apr 14 23:10:29 +0000 2016,2810999685,1460675429829,762,2810999685,"RT @dork74: Speedrun: ""Hardcore Henry"" in 60 seconds (s02ep02) 1A4 Studio-This is Brilliant!! @HardcoreHenry  https://t.co/xglVSiJN9o"
70,720751560670711812,BlackhawkZom,,I liked a @YouTube video https://t.co/PzpmhpG4SE Hardcore Henry- Movie Review,Thu Apr 14 23:12:17 +0000 2016,2995765719,1460675537637,20,2995765719,I liked a @YouTube video https://t.co/PzpmhpG4SE Hardcore Henry- Movie Review
71,720751696356450304,goodmoviesbad,,Stylish New 'Hardcore Henry' Mondo Poster is Utterly Bonkers https://t.co/AYh544WKb9 #movies #movienews #comicbooks,Thu Apr 14 23:12:49 +0000 2016,1137863136,1460675569987,1160,1137863136,Stylish New 'Hardcore Henry' Mondo Poster is Utterly Bonkers https://t.co/AYh544WKb9 #movies #movienews #comicbooks
72,720751748592373760,ReissDrewett,,"RT @pcgamer: Hardcore Henry can be fun, but videogames and filmmaking still mix poorly https://t.co/gW5ugHLJ36 https://t.co/NsQC5O03Fv",Thu Apr 14 23:13:02 +0000 2016,1653194960,1460675582441,1064,1653194960,"RT @pcgamer: Hardcore Henry can be fun, but videogames and filmmaking still mix poorly https://t.co/gW5ugHLJ36 https://t.co/NsQC5O03Fv"
73,720751978536681472,Lexmechanic,,It's time for @Auralnauts to make an image-stabilized version of Hardcore Henry.,Thu Apr 14 23:13:57 +0000 2016,15473867,1460675637264,820,15473867,It's time for @Auralnauts to make an image-stabilized version of Hardcore Henry.
74,720752377096179713,SacredWings,,I liked a @YouTube video from @creaturehub https://t.co/PnY6WQUSdY Hardcore Henry | Movie Night,Thu Apr 14 23:15:32 +0000 2016,1531205042,1460675732288,98,1531205042,I liked a @YouTube video from @creaturehub https://t.co/PnY6WQUSdY Hardcore Henry | Movie Night
75,720752413917974528,green3327,,Legitly the only people are in the theater watching hardcore Henry,Thu Apr 14 23:15:41 +0000 2016,349811900,1460675741067,120,349811900,Legitly the only people are in the theater watching hardcore Henry
76,720752764477915136,Daniel__Guy,,"Front row, empty theater for Hardcore Henry #masslisteria #masslisteriapodcast https://t.co/nLIz5O2u5G",Thu Apr 14 23:17:04 +0000 2016,396923512,1460675824647,94,396923512,"Front row, empty theater for Hardcore Henry #masslisteria #masslisteriapodcast https://t.co/nLIz5O2u5G"
77,720752864423837697,BigBagofRocks,,Hardcore Henry: exactly the type of movie I'd have made 15 years ago,Thu Apr 14 23:17:28 +0000 2016,27167032,1460675848476,196,27167032,Hardcore Henry: exactly the type of movie I'd have made 15 years ago
78,720753200572203008,GSTReviews,,Galactic Sugar Tea Review | Movies | Hardcore Henry | Kitty https://t.co/UmkejV0Gjg via @YouTube srry its late I'm not feeling to well-Kitty,Thu Apr 14 23:18:48 +0000 2016,4691806916,1460675928620,5,4691806916,Galactic Sugar Tea Review | Movies | Hardcore Henry | Kitty https://t.co/UmkejV0Gjg via @YouTube srry its late I'm not feeling to well-Kitty
79,720753404033818624,Onji_Dokeshi,,#HardcoreHenry well....I appreciate what this movie was trying to do. The first person perspective is... https://t.co/Y8AKSy7R5W,Thu Apr 14 23:19:37 +0000 2016,1460572058,1460675977129,64,1460572058,#HardcoreHenry well....I appreciate what this movie was trying to do. The first person perspective is... https://t.co/Y8AKSy7R5W
