index,id,user_screen_name,name,text,created_at,userid,timestamp_ms,followers_count,userid_str,text_1
523,720832368852934656,WestonHasty,,"Just saw Hardcore Henry. I'll tell you what, it's an experience.",Fri Apr 15 04:33:23 +0000 2016,570368609,1460694803809,507,570368609,"Just saw Hardcore Henry. I'll tell you what, it's an experience."
524,720832483982348288,GVPictures,,"RT @HardcoreHenry: On April 8th, the future of cinema arrives. #HardcoreHenry will change the action genre landscape forever!
https://t.co/",Fri Apr 15 04:33:51 +0000 2016,31671318,1460694831258,2807,31671318,"RT @HardcoreHenry: On April 8th, the future of cinema arrives. #HardcoreHenry will change the action genre landscape forever!
https://t.co/"
525,720832544728428549,GVPictures,,"RT @HardcoreHenry: Be part of a cinematic revolution. #HardcoreHenry, NOW PLAYING only in theaters. Get tix: https://t.co/QF9KK1JQLJ https:",Fri Apr 15 04:34:05 +0000 2016,31671318,1460694845741,2807,31671318,"RT @HardcoreHenry: Be part of a cinematic revolution. #HardcoreHenry, NOW PLAYING only in theaters. Get tix: https://t.co/QF9KK1JQLJ https:"
526,720832590211473408,GVPictures,,"RT @shirelinkin: @HardcoreHenry Was so fricken badass! Definitely one of my favorite movies of all time now! The action, music.. EVERYTHING",Fri Apr 15 04:34:16 +0000 2016,31671318,1460694856585,2807,31671318,"RT @shirelinkin: @HardcoreHenry Was so fricken badass! Definitely one of my favorite movies of all time now! The action, music.. EVERYTHING"
527,720832654455615488,chardiecheese,,@HardcoreHenry was fanbloodytastic,Fri Apr 15 04:34:31 +0000 2016,20016847,1460694871902,557,20016847,@HardcoreHenry was fanbloodytastic
528,720832962829266945,WeirdScienceDC,,"RT @EpicFilmGuys: ALL NEW! A review of @HardcoreHenry, #RogueOne trailer @SuicideSquadWB &amp; more! https://t.co/TRQU8PZdwl #PodernFamily http",Fri Apr 15 04:35:45 +0000 2016,1912862353,1460694945424,6066,1912862353,"RT @EpicFilmGuys: ALL NEW! A review of @HardcoreHenry, #RogueOne trailer @SuicideSquadWB &amp; more! https://t.co/TRQU8PZdwl #PodernFamily http"
529,720833139925331968,ccosmedical,,Hardcore Henry (FILM 2015) online subtitrat - Filme Online: https://t.co/HF1rGOCp8J,Fri Apr 15 04:36:27 +0000 2016,2518285386,1460694987647,8,2518285386,Hardcore Henry (FILM 2015) online subtitrat - Filme Online: https://t.co/HF1rGOCp8J
530,720833391914934272,SoloBoxer26,,I liked a @YouTube video https://t.co/k4nE1SPZWF Half in the Bag Episode 107: Hardcore Henry,Fri Apr 15 04:37:27 +0000 2016,454018003,1460695047726,82,454018003,I liked a @YouTube video https://t.co/k4nE1SPZWF Half in the Bag Episode 107: Hardcore Henry
531,720834011975667713,eg24hrs,,time to watch Hardcore Henry,Fri Apr 15 04:39:55 +0000 2016,3177780204,1460695195560,23,3177780204,time to watch Hardcore Henry
532,720834176262377472,Nintendojitsu,,Hardcore Henry is awesome.,Fri Apr 15 04:40:34 +0000 2016,19845034,1460695234729,1900,19845034,Hardcore Henry is awesome.
533,720834251709517825,BabyVick122,,Hardcore Henry is a weird movie,Fri Apr 15 04:40:52 +0000 2016,370406792,1460695252717,745,370406792,Hardcore Henry is a weird movie
534,720834261335412736,JoestarVergil,,"RT @HardcoreHenry: Be part of a cinematic revolution. #HardcoreHenry, NOW PLAYING only in theaters. Get tix: https://t.co/QF9KK1JQLJ https:",Fri Apr 15 04:40:55 +0000 2016,4754803101,1460695255012,87,4754803101,"RT @HardcoreHenry: Be part of a cinematic revolution. #HardcoreHenry, NOW PLAYING only in theaters. Get tix: https://t.co/QF9KK1JQLJ https:"
535,720834410967228420,NintendoLisa,,RT @Nintendojitsu: Hardcore Henry is awesome.,Fri Apr 15 04:41:30 +0000 2016,706739432922214400,1460695290687,47,706739432922214400,RT @Nintendojitsu: Hardcore Henry is awesome.
536,720834493955706880,cyrusarnold,,@travisfazekas @HardcoreHenry Thank you!!,Fri Apr 15 04:41:50 +0000 2016,1498894436,1460695310473,448,1498894436,@travisfazekas @HardcoreHenry Thank you!!
537,720834732666150912,PaytonSquared,,"I'm at Cinemark Carson &amp; XD for Hardcore Henry in Carson, Calif https://t.co/qbGxrsrZIv",Fri Apr 15 04:42:47 +0000 2016,76232411,1460695367386,299,76232411,"I'm at Cinemark Carson &amp; XD for Hardcore Henry in Carson, Calif https://t.co/qbGxrsrZIv"
538,720834945598365697,cambean29,,Hardcore Henry was a badass movie,Fri Apr 15 04:43:38 +0000 2016,1265907926,1460695418153,940,1265907926,Hardcore Henry was a badass movie
539,720835049306742784,NEONPACHI,,RT @cambean29: Hardcore Henry was a badass movie,Fri Apr 15 04:44:02 +0000 2016,1262870222,1460695442879,889,1262870222,RT @cambean29: Hardcore Henry was a badass movie
540,720835334615879680,PucheroChan,,"#payday2 just went hardcore. U can now play as ""coke jimmy"" - the craziest jimmy from #hardcorehenry. by sharltocop https://t.co/PjSowtS8mR",Fri Apr 15 04:45:10 +0000 2016,202467877,1460695510902,253,202467877,"#payday2 just went hardcore. U can now play as ""coke jimmy"" - the craziest jimmy from #hardcorehenry. by sharltocop https://t.co/PjSowtS8mR"
541,720835500500619264,patrick11939933,,About to watch Hardcore Henry...... Pretty excited,Fri Apr 15 04:45:50 +0000 2016,701178050084343810,1460695550452,3,701178050084343810,About to watch Hardcore Henry...... Pretty excited
542,720835554493923329,superheroDJ,,"Listen. ""Hardcore Henry"" might be the WILDEST FILM I've ever seen. Ever! It's not gonna win any Oscars but for... https://t.co/rhNzGZpgqE",Fri Apr 15 04:46:03 +0000 2016,35630387,1460695563325,2315,35630387,"Listen. ""Hardcore Henry"" might be the WILDEST FILM I've ever seen. Ever! It's not gonna win any Oscars but for... https://t.co/rhNzGZpgqE"
543,720835604158619648,RaY_SladE123,,Hardcore Henry was a dope movie,Fri Apr 15 04:46:15 +0000 2016,60679187,1460695575166,822,60679187,Hardcore Henry was a dope movie
544,720836026176897026,TheDeadShockify,,"In case you didn't watch my stream, I talked about how ass Hardcore Henry is. Stream should be up tomorrow afternoon.",Fri Apr 15 04:47:55 +0000 2016,138919573,1460695675783,45,138919573,"In case you didn't watch my stream, I talked about how ass Hardcore Henry is. Stream should be up tomorrow afternoon."
545,720836248911224833,The_Otaco,,Hardcore Henry review: EZ/10,Fri Apr 15 04:48:48 +0000 2016,20487915,1460695728887,251,20487915,Hardcore Henry review: EZ/10
546,720836391244935171,Beosose_,,Currently watching hardcore Henry,Fri Apr 15 04:49:22 +0000 2016,811962252,1460695762822,581,811962252,Currently watching hardcore Henry
547,720836688646307844,SkylarVanWyck,,hardcore Henry was fucking,Fri Apr 15 04:50:33 +0000 2016,24600663,1460695833728,271,24600663,hardcore Henry was fucking
548,720836801787666432,LinkG07,,Hardcore Henry was pretty legit,Fri Apr 15 04:51:00 +0000 2016,23172391,1460695860703,350,23172391,Hardcore Henry was pretty legit
549,720837010781417472,KodyJBW,,"@sharlto was the best part of @HardcoreHenry, all of him; a place in my heart for this manic boykie right here!  https://t.co/brqALh9XBl",Fri Apr 15 04:51:50 +0000 2016,396146086,1460695910531,135,396146086,"@sharlto was the best part of @HardcoreHenry, all of him; a place in my heart for this manic boykie right here!  https://t.co/brqALh9XBl"
550,720837028598788096,KaileyDudley,,RT @cambean29: Hardcore Henry was a badass movie,Fri Apr 15 04:51:54 +0000 2016,356638990,1460695914779,573,356638990,RT @cambean29: Hardcore Henry was a badass movie
551,720837307717148673,JB_Arnold,,RT @RaY_SladE123: Hardcore Henry was a dope movie,Fri Apr 15 04:53:01 +0000 2016,1499804718,1460695981326,1121,1499804718,RT @RaY_SladE123: Hardcore Henry was a dope movie
552,720837388126146560,Stephonmyknee76,,"I'm at Century Cinema 16 - @cinemark for Hardcore Henry in Mountain View, CA https://t.co/YyiiCj7JWg",Fri Apr 15 04:53:20 +0000 2016,23394592,1460696000497,93,23394592,"I'm at Century Cinema 16 - @cinemark for Hardcore Henry in Mountain View, CA https://t.co/YyiiCj7JWg"
553,720837685917589505,JibriMaceo616,,Hardcore Henry was so bad it was a amazing. I watched a guy get his balls squeezed so hard they exploded,Fri Apr 15 04:54:31 +0000 2016,976692769,1460696071496,174,976692769,Hardcore Henry was so bad it was a amazing. I watched a guy get his balls squeezed so hard they exploded
554,720837881724424192,TheFerbguy,,"So @JeremyJahns, How about @HardcoreHenry? Any thoughts on this film?",Fri Apr 15 04:55:18 +0000 2016,1834472503,1460696118180,156,1834472503,"So @JeremyJahns, How about @HardcoreHenry? Any thoughts on this film?"
555,720838110112681986,mmquaids,,I like the original HARDCORE HENRY better. #movies https://t.co/zejjT6WR43,Fri Apr 15 04:56:12 +0000 2016,58597340,1460696172632,29,58597340,I like the original HARDCORE HENRY better. #movies https://t.co/zejjT6WR43
556,720838506340163584,LoveKeKeB,,Hardcore Henry is a hilariously long parkour video basically,Fri Apr 15 04:57:47 +0000 2016,1213476368,1460696267100,160,1213476368,Hardcore Henry is a hilariously long parkour video basically
557,720838641111576577,JOHNMILLS72,,RT @amccinemas_UK: Want to #Win @HardcoreHenry prizes? #Retweet this and #Follow our #Instagram page to enter https://t.co/hILcXRHsOM https,Fri Apr 15 04:58:19 +0000 2016,46437618,1460696299232,2442,46437618,RT @amccinemas_UK: Want to #Win @HardcoreHenry prizes? #Retweet this and #Follow our #Instagram page to enter https://t.co/hILcXRHsOM https
558,720839159049420800,Eyoyooo,,RT @JibriMaceo616: Hardcore Henry was so bad it was a amazing. I watched a guy get his balls squeezed so hard they exploded,Fri Apr 15 05:00:22 +0000 2016,362117512,1460696422718,325,362117512,RT @JibriMaceo616: Hardcore Henry was so bad it was a amazing. I watched a guy get his balls squeezed so hard they exploded
559,720839230553886722,Shadogun,,"10/10, would follow my heart again. #HardcoreHenry https://t.co/koekEHIJw4",Fri Apr 15 05:00:39 +0000 2016,1110358195,1460696439766,45,1110358195,"10/10, would follow my heart again. #HardcoreHenry https://t.co/koekEHIJw4"
560,720839618308902913,OwnLessLiveMore,,"Have you seen the movie ""Hardcore Henry""?  I saw it today.  One word:  wow.  #HardcoreHenry #GoPro #movie #ActionMovie #IncredibleStunts",Fri Apr 15 05:02:12 +0000 2016,374724306,1460696532214,4989,374724306,"Have you seen the movie ""Hardcore Henry""?  I saw it today.  One word:  wow.  #HardcoreHenry #GoPro #movie #ActionMovie #IncredibleStunts"
561,720839671551381504,AyeDub_,,"Low key, Hardcore Henry is high key ehhhh",Fri Apr 15 05:02:24 +0000 2016,145037140,1460696544908,310,145037140,"Low key, Hardcore Henry is high key ehhhh"
562,720839847347298305,TehFalom,,"If they don't get Hardcore Henry on Netflix, or Google Play, I'm gonna lose all faith in humanity.",Fri Apr 15 05:03:06 +0000 2016,1141022574,1460696586821,126,1141022574,"If they don't get Hardcore Henry on Netflix, or Google Play, I'm gonna lose all faith in humanity."
563,720840097105448961,filmosopherblog,,HARDCORE HENRY: a high-octane action flick w/ little regard for plot or logic. That's exactly why it's so much fun. 3/5 #HardcoreHenry,Fri Apr 15 05:04:06 +0000 2016,3102532903,1460696646368,44,3102532903,HARDCORE HENRY: a high-octane action flick w/ little regard for plot or logic. That's exactly why it's so much fun. 3/5 #HardcoreHenry
564,720840579328774145,jqu3ma_iq,,Bruhhhhh Don't stop me now?!?! That's how were having the climax THANK YOU HARDCORE HENRY,Fri Apr 15 05:06:01 +0000 2016,89576712,1460696761339,112,89576712,Bruhhhhh Don't stop me now?!?! That's how were having the climax THANK YOU HARDCORE HENRY
565,720841423965163520,JosephKluck,,"Movies 9-12: 4/5 Batman vs Superman, 4/10 Eye in the Sky, 4/12 Demolition, and 4/14 Hardcore Henry. Demolition is my favorite #FiftyMovies",Fri Apr 15 05:09:22 +0000 2016,240585715,1460696962716,66,240585715,"Movies 9-12: 4/5 Batman vs Superman, 4/10 Eye in the Sky, 4/12 Demolition, and 4/14 Hardcore Henry. Demolition is my favorite #FiftyMovies"
566,720841538993917952,JayD536,,"Well, decided not to watch #HardcoreHenry but watching #TheJungleBook it was great",Fri Apr 15 05:09:50 +0000 2016,720580561287450624,1460696990141,5,720580561287450624,"Well, decided not to watch #HardcoreHenry but watching #TheJungleBook it was great"
567,720842023557664769,maxcfg,,El video de hardcorehenry https://t.co/1ldLwfVPOU,Fri Apr 15 05:11:45 +0000 2016,155716647,1460697105670,41,155716647,El video de hardcorehenry https://t.co/1ldLwfVPOU
568,720842230370402304,Evanhaegele,,Who wants to see hardcore Henry at 11 in canyon country,Fri Apr 15 05:12:34 +0000 2016,149649272,1460697154978,730,149649272,Who wants to see hardcore Henry at 11 in canyon country
569,720843368423514114,watchTopMovie,,"watch Hardcore Henry 2016 | Full Movie Online, Streaming in HD Free
https://t.co/hEJYGsRgGs",Fri Apr 15 05:17:06 +0000 2016,713060201939599360,1460697426311,937,713060201939599360,"watch Hardcore Henry 2016 | Full Movie Online, Streaming in HD Free
https://t.co/hEJYGsRgGs"
570,720843716521398272,ImgurTweetBot,,Im Sharlto Copley from Hardcore Henry. AMA!: https://t.co/7hggbpRLD8,Fri Apr 15 05:18:29 +0000 2016,720826809508466694,1460697509304,1,720826809508466694,Im Sharlto Copley from Hardcore Henry. AMA!: https://t.co/7hggbpRLD8
571,720844605764149249,CarmelChewy,,Hardcore Henry was such a damn good movie.,Fri Apr 15 05:22:01 +0000 2016,113811781,1460697721316,434,113811781,Hardcore Henry was such a damn good movie.
572,720844731190620161,jqu3ma_iq,,THIS MOVIE WAS FUCKING INSANE THANK YOU HARDCORE HENRY JESUS CHRIST,Fri Apr 15 05:22:31 +0000 2016,89576712,1460697751220,112,89576712,THIS MOVIE WAS FUCKING INSANE THANK YOU HARDCORE HENRY JESUS CHRIST
573,720844791596986368,TheGamerZane8,,"Just saw Hardcore Henry, and HOLY HECK ITS SO FREAKING AWESOME!",Fri Apr 15 05:22:45 +0000 2016,3777803533,1460697765622,21,3777803533,"Just saw Hardcore Henry, and HOLY HECK ITS SO FREAKING AWESOME!"
574,720844989677195265,_______TG,,Hardcore Henry was dope,Fri Apr 15 05:23:32 +0000 2016,165543193,1460697812848,1771,165543193,Hardcore Henry was dope
575,720845020945715201,TheTrentMiller,,For all you badass chicks out there and my Bros hardcore Henry is highly recommended  Russians are wild...,Fri Apr 15 05:23:40 +0000 2016,103358787,1460697820303,753,103358787,For all you badass chicks out there and my Bros hardcore Henry is highly recommended  Russians are wild...
576,720845285795110912,Tinylilyjess,,RT @amccinemas_UK: Want to #Win @HardcoreHenry prizes? #Retweet this and #Follow our #Instagram page to enter https://t.co/hILcXRHsOM https,Fri Apr 15 05:24:43 +0000 2016,2367030221,1460697883448,1295,2367030221,RT @amccinemas_UK: Want to #Win @HardcoreHenry prizes? #Retweet this and #Follow our #Instagram page to enter https://t.co/hILcXRHsOM https
577,720845362483712000,Gaaaaona,,@Shesjustnicolle lol welcome! Let's go watch hardcore henry!,Fri Apr 15 05:25:01 +0000 2016,174506593,1460697901732,1449,174506593,@Shesjustnicolle lol welcome! Let's go watch hardcore henry!
578,720846556388167680,0vrstart,,"@0vrstart nvrmind, they showed. Just missed the first 10 minutes of Hardcore Henry. Don't care- GREAT movie!!",Fri Apr 15 05:29:46 +0000 2016,171945793,1460698186381,411,171945793,"@0vrstart nvrmind, they showed. Just missed the first 10 minutes of Hardcore Henry. Don't care- GREAT movie!!"
579,720846777524420613,ActonPhilip,,RT @amccinemas_UK: Want to #Win @HardcoreHenry prizes? #Retweet this and #Follow our #Instagram page to enter https://t.co/hILcXRHsOM https,Fri Apr 15 05:30:39 +0000 2016,2623372053,1460698239104,1974,2623372053,RT @amccinemas_UK: Want to #Win @HardcoreHenry prizes? #Retweet this and #Follow our #Instagram page to enter https://t.co/hILcXRHsOM https
580,720846987445186560,shinjanaytor,,"Hardcore Henry was a lot of fun, and quite a cinematic experience.",Fri Apr 15 05:31:29 +0000 2016,232440435,1460698289153,426,232440435,"Hardcore Henry was a lot of fun, and quite a cinematic experience."
581,720847213383933953,budomate,,@HardcoreHenry has a breathe of something new in genre that only action junkies understand! https://t.co/7erjagvfpi https://t.co/fnKF6ZzHWr,Fri Apr 15 05:32:23 +0000 2016,46388607,1460698343021,16229,46388607,@HardcoreHenry has a breathe of something new in genre that only action junkies understand! https://t.co/7erjagvfpi https://t.co/fnKF6ZzHWr
582,720847492795904001,emuleteca,,Viendo... Hardcore Henry 2015 On Line D.D. https://t.co/oqWRcyYlJA,Fri Apr 15 05:33:29 +0000 2016,185996932,1460698409638,135,185996932,Viendo... Hardcore Henry 2015 On Line D.D. https://t.co/oqWRcyYlJA
583,720847711113576448,danman5k,,Saw @HardcoreHenry with @SurrealKevbo was cool! Defo worth the watch  felt like your in a game lol,Fri Apr 15 05:34:21 +0000 2016,45827456,1460698461689,410,45827456,Saw @HardcoreHenry with @SurrealKevbo was cool! Defo worth the watch  felt like your in a game lol
584,720847818533896192,Dorsetecho,,"FRIDAY FILM REVIEW: Jungle Book, Eye in the Sky, Midnight Special, Hardcore Henry https://t.co/0oIK6s7PtC",Fri Apr 15 05:34:47 +0000 2016,23453238,1460698487300,33238,23453238,"FRIDAY FILM REVIEW: Jungle Book, Eye in the Sky, Midnight Special, Hardcore Henry https://t.co/0oIK6s7PtC"
585,720847825513238528,thisisdorset,,"FRIDAY FILM REVIEW: Jungle Book, Eye in the Sky, Midnight Special, Hardcore Henry: HERE'S our guide to the bes... https://t.co/rvo610Kkce",Fri Apr 15 05:34:48 +0000 2016,59417075,1460698488964,12194,59417075,"FRIDAY FILM REVIEW: Jungle Book, Eye in the Sky, Midnight Special, Hardcore Henry: HERE'S our guide to the bes... https://t.co/rvo610Kkce"
586,720848042174193664,alinssite,,I'm watching Hardcore Henry (2016) https://t.co/bKHJepWV29 #trakt,Fri Apr 15 05:35:40 +0000 2016,12894332,1460698540620,107,12894332,I'm watching Hardcore Henry (2016) https://t.co/bKHJepWV29 #trakt
587,720848893634674688,AlexanDramaa,,Necesito ver Hardcore Henry en 3D.,Fri Apr 15 05:39:03 +0000 2016,80492380,1460698743624,725,80492380,Necesito ver Hardcore Henry en 3D.
588,720848921707159552,travisfazekas,,@ImpressionBlend hey marianna i totally agree on everything you said about hardcore henry which was a super badass fucking awesome movie,Fri Apr 15 05:39:10 +0000 2016,3187175508,1460698750317,22,3187175508,@ImpressionBlend hey marianna i totally agree on everything you said about hardcore henry which was a super badass fucking awesome movie
589,720848931811250177,CyRaptor,,Hardcore Henry looks like an on-rails FMV lightgun game,Fri Apr 15 05:39:12 +0000 2016,307940926,1460698752726,41,307940926,Hardcore Henry looks like an on-rails FMV lightgun game
590,720849082982379521,lkhrs,,"I'm convinced Hardcore Henry is the best action movie I'm going to ever see this year, or maybe for several years. That was amazing.",Fri Apr 15 05:39:48 +0000 2016,205346414,1460698788768,1439,205346414,"I'm convinced Hardcore Henry is the best action movie I'm going to ever see this year, or maybe for several years. That was amazing."
591,720849193644859392,urahara775,,I liked a @YouTube video https://t.co/hyhQtSdetg Half in the Bag Episode 107: Hardcore Henry,Fri Apr 15 05:40:15 +0000 2016,191651629,1460698815152,122,191651629,I liked a @YouTube video https://t.co/hyhQtSdetg Half in the Bag Episode 107: Hardcore Henry
592,720849419340349440,ImgurTweetBot,,Im Sharlto Copley from Hardcore Henry. AMA!: https://t.co/fcPee7h75F taste buds are ready: https://t.co/2pX2aTCuHA,Fri Apr 15 05:41:08 +0000 2016,720826809508466694,1460698868962,1,720826809508466694,Im Sharlto Copley from Hardcore Henry. AMA!: https://t.co/fcPee7h75F taste buds are ready: https://t.co/2pX2aTCuHA
593,720849839257288704,heyraney,,Hardcore Henry. Holy crap,Fri Apr 15 05:42:49 +0000 2016,28053060,1460698969078,594,28053060,Hardcore Henry. Holy crap
594,720849937026588672,KLC2978,,"RT @Dorsetecho: FRIDAY FILM REVIEW: Jungle Book, Eye in the Sky, Midnight Special, Hardcore Henry https://t.co/0oIK6s7PtC",Fri Apr 15 05:43:12 +0000 2016,2591839421,1460698992388,712,2591839421,"RT @Dorsetecho: FRIDAY FILM REVIEW: Jungle Book, Eye in the Sky, Midnight Special, Hardcore Henry https://t.co/0oIK6s7PtC"
595,720850248361385984,lirolapin213,,(Bande-annonce) Hardcore Henry : https://t.co/OrWdpQ2iRD #HardcoreHenry,Fri Apr 15 05:44:26 +0000 2016,3070250986,1460699066616,461,3070250986,(Bande-annonce) Hardcore Henry : https://t.co/OrWdpQ2iRD #HardcoreHenry
596,720850326408941568,EvanLinneman31,,The Jungle Book was an amazing movie for my collection. Perfect 10/10 I got lucky cuz Hardcore Henry was a 10/10 as well.,Fri Apr 15 05:44:45 +0000 2016,52992578,1460699085224,163,52992578,The Jungle Book was an amazing movie for my collection. Perfect 10/10 I got lucky cuz Hardcore Henry was a 10/10 as well.
597,720850871613980672,HezJP,,"RT @jeffgerstmann: If Hardcore Henry stopped for even a moment to let you consider what was happening, none of it would work at all.",Fri Apr 15 05:46:55 +0000 2016,703724478686236672,1460699215211,45,703724478686236672,"RT @jeffgerstmann: If Hardcore Henry stopped for even a moment to let you consider what was happening, none of it would work at all."
598,720851159204777984,DamarissMariee,,Hardcore Henry  Highly Recommended ,Fri Apr 15 05:48:03 +0000 2016,62905469,1460699283778,511,62905469,Hardcore Henry  Highly Recommended 
599,720851439442989056,stiwi_exe,,i love hardcore henry so much but whats weird is that akan is probably the first villain that i didnt like lol,Fri Apr 15 05:49:10 +0000 2016,854631266,1460699350592,26,854631266,i love hardcore henry so much but whats weird is that akan is probably the first villain that i didnt like lol
600,720851537363251200,ninamnam,,"Went to see Hardcore Henry with him last night, it was a positive surprise how entertaining it actually was",Fri Apr 15 05:49:33 +0000 2016,393292055,1460699373938,567,393292055,"Went to see Hardcore Henry with him last night, it was a positive surprise how entertaining it actually was"
601,720851642841628672,zeemonkee,,So is Hardcore henry just an extremely violent Peep Show episode? Will he turn out to be Mark Corrigan in the end?,Fri Apr 15 05:49:59 +0000 2016,86730464,1460699399086,441,86730464,So is Hardcore henry just an extremely violent Peep Show episode? Will he turn out to be Mark Corrigan in the end?
602,720851674084970497,joslynmadu,,Why was Hardcore Henry a sleeper movie? That film has changed the game for action movies the same way Ex Machina changed sci-fi movies.,Fri Apr 15 05:50:06 +0000 2016,4519163034,1460699406535,19,4519163034,Why was Hardcore Henry a sleeper movie? That film has changed the game for action movies the same way Ex Machina changed sci-fi movies.
603,720851990104793089,muhdfadli27,,Hardcore henry r21 wtf,Fri Apr 15 05:51:21 +0000 2016,864867236,1460699481880,2736,864867236,Hardcore henry r21 wtf
604,720852005753741312,APOLLOJUSTlCE,,hardcore henry was terrible,Fri Apr 15 05:51:25 +0000 2016,2326673856,1460699485611,161,2326673856,hardcore henry was terrible
605,720852865544159232,chinawhiteboy,,Hardcore Henry was fuckin hardcore,Fri Apr 15 05:54:50 +0000 2016,4054289893,1460699690601,89,4054289893,Hardcore Henry was fuckin hardcore
606,720853048247980032,AttObl,,Will probably see Hardcore Henry today. Hope it's good.,Fri Apr 15 05:55:34 +0000 2016,259361475,1460699734161,1286,259361475,Will probably see Hardcore Henry today. Hope it's good.
607,720853272756486144,gabe__diaz,,I'm tryna see hardcore Henry again this weekend,Fri Apr 15 05:56:27 +0000 2016,881584508,1460699787688,950,881584508,I'm tryna see hardcore Henry again this weekend
608,720853534699196416,TyRellington,,Hardcore Henry was a wild ass movie,Fri Apr 15 05:57:30 +0000 2016,23717054,1460699850140,3259,23717054,Hardcore Henry was a wild ass movie
609,720853652823416832,x0r06,,Half in the Bag Episode 107: Hardcore Henry https://t.co/iIMtm38468 via @YouTube,Fri Apr 15 05:57:58 +0000 2016,705914099457236993,1460699878303,20,705914099457236993,Half in the Bag Episode 107: Hardcore Henry https://t.co/iIMtm38468 via @YouTube
610,720853754321342465,fredss33,,RT @amccinemas_UK: Want to #Win @HardcoreHenry prizes? #Retweet this and #Follow our #Instagram page to enter https://t.co/hILcXRHsOM https,Fri Apr 15 05:58:22 +0000 2016,63438639,1460699902502,1462,63438639,RT @amccinemas_UK: Want to #Win @HardcoreHenry prizes? #Retweet this and #Follow our #Instagram page to enter https://t.co/hILcXRHsOM https
611,720853789637353473,fredss33,,RT @amccinemas_UK: #Win @HardcoreHenry prizes? #RT  #Follow our #Instagram page to enter https://t.co/EdEOJnyr66 https://t.co/j6J2a8mHd3 ,Fri Apr 15 05:58:30 +0000 2016,63438639,1460699910922,1462,63438639,RT @amccinemas_UK: #Win @HardcoreHenry prizes? #RT  #Follow our #Instagram page to enter https://t.co/EdEOJnyr66 https://t.co/j6J2a8mHd3 
612,720854399992471552,Lingerfeels,,RT @amccinemas_UK: Want to #Win @HardcoreHenry prizes? #Retweet this and #Follow our #Instagram page to enter https://t.co/hILcXRHsOM https,Fri Apr 15 06:00:56 +0000 2016,4917992902,1460700056442,2175,4917992902,RT @amccinemas_UK: Want to #Win @HardcoreHenry prizes? #Retweet this and #Follow our #Instagram page to enter https://t.co/hILcXRHsOM https
613,720854828134498304,ROBINMATTO,,#HardcoreHenry was a VERY strange film indeed but I think I liked it...,Fri Apr 15 06:02:38 +0000 2016,334938789,1460700158519,849,334938789,#HardcoreHenry was a VERY strange film indeed but I think I liked it...
614,720854893905334272,AttObl,,@sirwence I'm surprised that Hardcore Henry isn't going to innuendo territory just because of the title.,Fri Apr 15 06:02:54 +0000 2016,259361475,1460700174200,1286,259361475,@sirwence I'm surprised that Hardcore Henry isn't going to innuendo territory just because of the title.
615,720855591548096513,pokerpater,,Watched #hardcorehenry last night. Best use of gratuitous violence ever !,Fri Apr 15 06:05:40 +0000 2016,250855888,1460700340531,117,250855888,Watched #hardcorehenry last night. Best use of gratuitous violence ever !
